{
  "schema_version": 2,
  "task_id": "example-task",
  "mode": "feature",
  "status": "planning",
  "request": "Describe the requested change.",
  "base_branch": "main",
  "base_sha": "<base-sha>",
  "head_branch": "vibe/feature/example-task",
  "head_sha": "<head-sha>",
  "targets": [],
  "context": {
    "symbols": [],
    "dependencies": [],
    "consumers": [],
    "tests": [],
    "config_files": [],
    "observed_files": []
  },
  "acceptance": [
    {
      "id": "AC1",
      "expected": "Observable expected result",
      "status": "pending",
      "evidence": []
    }
  ],
  "verification": {
    "commands": [],
    "head_sha": null,
    "ci_run_id": null,
    "status": null
  },
  "uncertainties": []
}
